{
 "generated_utc": "2026-10-26T07:02:39Z",
 "asked": 176,
 "count": 33,
 "paused": [],
 "changes": [],
 "stale": 0,
 "unread_chains": [],
 "by_target": {
  "arbitrum:0xe23b4ae3624fb6f7cdef29bc8ead912f1ede6886": {
   "paused": false,
   "via": "paused()",
   "since": null
  },
  "base:0x420dd381b31aef6683db6b902084cb0ffece40da": {
   "paused": false,
   "via": "isPaused()",
   "since": null
  },
  "ethereum-l1:0xc139190f447e929f090edeb554d95abb8b18ac1c": {
   "paused": false,
   "via": "paused()",
   "since": null
  },
  "ethereum-l1:0x2260fac5e5542a773aa44fbcfedf7c193bc2c599": {
   "paused": false,
   "via": "paused()",
   "since": null
  },
  "ethereum-l1:0x858646372cc42e1a627fce94aa7a7033e7cf075a": {
   "paused": false,
   "via": "paused()",
   "since": null
  },
  "ethereum-l1:0xa0b86991c6218b36c1d19d4a2e9eb0ce3606eb48": {
   "paused": false,
   "via": "paused()",
   "since": null
  },
  "ethereum-l1:0xdac17f958d2ee523a2206206994597c13d831ec7": {
   "paused": false,
   "via": "paused()",
   "since": null
  },
  "ethereum-l1:0x6c3ea9036406852006290770bedfcaba0e23a0e8": {
   "paused": false,
   "via": "paused()",
   "since": null
  },
  "ethereum-l1:0xc5f0f7b66764f6ec8c8dff7ba683102295e16409": {
   "paused": false,
   "via": "paused()",
   "since": null
  },
  "ethereum-l1:0x49048044d57e1c92a77f79988d21fa8faf74e97e": {
   "paused": false,
   "via": "paused()",
   "since": null
  },
  "monad:0xd691b0afed67f96cec28ab6308cbe5b2c103b7e9": {
   "paused": false,
   "via": "paused()",
   "since": null
  },
  "monad:0x36878c6fca7e0e8a88f90dc410cfbbca5b695c95": {
   "paused": false,
   "via": "isPaused()",
   "since": null
  },
  "plasma:0x6695c0f8706c5ace3bdf8995073179cca47926dc": {
   "paused": false,
   "via": "paused()",
   "since": null
  },
  "robinhood:0x322f0929c4625ed5bad873c95208d54e1c003b2d": {
   "paused": false,
   "via": "paused()",
   "since": null
  },
  "robinhood:0x12f190a9f9d7d37a250758b26824b97ce941bf54": {
   "paused": false,
   "via": "paused()",
   "since": null
  },
  "robinhood:0x894e1ec2d74ffe5aef8dc8a9e84686accb964f2a": {
   "paused": false,
   "via": "paused()",
   "since": null
  },
  "robinhood:0xe0444ef8bf4ed74f74fd73686e2ddf4c1c5591e8": {
   "paused": false,
   "via": "paused()",
   "since": null
  },
  "robinhood:0x86923f96303d656e4aa86d9d42d1e57ad2023fdc": {
   "paused": false,
   "via": "paused()",
   "since": null
  },
  "robinhood:0x292fc50e4eb66c3f6514b9e402dbc25961824d62": {
   "paused": false,
   "via": "paused()",
   "since": null
  },
  "robinhood:0x0dc846db6a4ec7b5a3e542f7db88049e9add2541": {
   "paused": false,
   "via": "paused()",
   "since": null
  },
  "robinhood:0x1195c074f898b7644ba732407619c9804dfe6dce": {
   "paused": false,
   "via": "paused()",
   "since": null
  },
  "robinhood:0xd5c6c79692715145098a65d1eb1f2a10c524f8e8": {
   "paused": false,
   "via": "paused()",
   "since": null
  },
  "robinhood:0x5c98b2d892b37c9a1d3b69472bddc172a64cdc09": {
   "paused": false,
   "via": "isPaused()",
   "since": null
  },
  "robinhood:0xd01c774d4a66408326bc65728ac5ae5aaf004032": {
   "paused": false,
   "via": "paused()",
   "since": null
  },
  "tempo:0x20c000000000000000000000b9537d11c60e8b50": {
   "paused": false,
   "via": "paused()",
   "since": null
  },
  "tempo:0x20c00000000000000000000014f22ca97301eb73": {
   "paused": false,
   "via": "paused()",
   "since": null
  },
  "tempo:0x20c0000000000000000000000000000000000000": {
   "paused": false,
   "via": "paused()",
   "since": null
  },
  "tempo:0x20c0000000000000000000003158081efd85bfc2": {
   "paused": false,
   "via": "paused()",
   "since": null
  },
  "tempo:0x20c000000000000000000000c412ec89d0c08be5": {
   "paused": false,
   "via": "paused()",
   "since": null
  },
  "tempo:0x20c00000000000000000000058d0b8b2cfdb358c": {
   "paused": false,
   "via": "paused()",
   "since": null
  },
  "tempo:0x20c0000000000000000000006fd9a167923ba194": {
   "paused": false,
   "via": "paused()",
   "since": null
  },
  "tempo:0x20c0000000000000000000001621e21f71cf12fb": {
   "paused": false,
   "via": "paused()",
   "since": null
  },
  "tempo:0x20c0000000000000000000000520792dcccccccc": {
   "paused": false,
   "via": "paused()",
   "since": null
  }
 },
 "what": "pause state of the tracked EVM contracts that expose paused() or isPaused(): `paused` lists the paused ones, `changes` the flips since the previous run (running to paused, paused to running); a contract without the getter is absent, not running; a record kept from the previous run for a call that went unanswered is marked stale and never fires; read by scripts/pause_state.py"
}